{
  "id": "al-tirana-myslymshyri-17",
  "market": "AL",
  "captured_at": "2026-10-12T00:00:00Z",
  "source": {
    "kind": "nutzer",
    "url": "https://desrealestate.al/sq/property/shitet-apartament-21-ne-myslym-shyr-tirane/",
    "documents": [
      "al-tirana-myslymshyri-17.txt"
    ]
  },
  "core": {
    "purchase_price": {
      "value": 85000,
      "status": "belegt",
      "source": {
        "kind": "makler",
        "quote": "Kaufpreis: 85’000 EUR"
      }
    },
    "living_area_m2": {
      "value": 72,
      "status": "belegt",
      "source": {
        "kind": "makler",
        "quote": "Wohnfläche: 72 m²"
      }
    },
    "monthly_rent": {
      "value": null,
      "status": "fehlend",
      "source": {
        "kind": "makler",
        "note": "Keine Mietangabe im Text"
      }
    },
    "currency": "EUR"
  },
  "object": {
    "type": "wohnung"
  },
  "notes": "GOLD (Regeltest auf Zusammenfassung vom 12.10.2026); Grenzfälle vom Owner entschieden."
}
