{
  "id": "at-graz-dietrichsteinplatz-08",
  "market": "AT",
  "captured_at": "2026-10-12T00:00:00Z",
  "source": {
    "kind": "nutzer",
    "url": "https://www.immobilienscout24.at/expose/6ab53b5d4721c3e4cede41d5",
    "documents": [
      "at-graz-dietrichsteinplatz-08.txt"
    ]
  },
  "core": {
    "purchase_price": {
      "value": 150000,
      "status": "belegt",
      "source": {
        "kind": "portal",
        "quote": "Kaufpreis: 150’000 EUR"
      }
    },
    "living_area_m2": {
      "value": 58,
      "status": "belegt",
      "source": {
        "kind": "portal",
        "quote": "Wohnfläche: 58 m²"
      }
    },
    "monthly_rent": {
      "value": null,
      "status": "fehlend",
      "source": {
        "kind": "portal",
        "note": "Keine Mietangabe im Text"
      }
    },
    "currency": "EUR"
  },
  "object": {
    "type": "wohnung"
  },
  "notes": "GOLD (Regeltest auf Zusammenfassung vom 12.10.2026); Grenzfälle vom Owner entschieden."
}
