{
  "id": "mk-skopje-kiselavoda-12",
  "market": "MK",
  "captured_at": "2026-10-13T13:10:00Z",
  "source": {
    "kind": "portal",
    "portal": "level.mk",
    "url": "https://level.mk/en/property/apartment-sale-skopje-40m2-7/",
    "documents": [
      "mk-skopje-kiselavoda-12.txt"
    ]
  },
  "core": {
    "purchase_price": {
      "value": 80000,
      "status": "belegt",
      "source": {
        "kind": "portal",
        "quote": "Price: €80.000",
        "note": "Englische Portalfassung (Link im Manifest)"
      }
    },
    "living_area_m2": {
      "value": 40,
      "status": "belegt",
      "source": {
        "kind": "portal",
        "quote": "Area: 40 m²",
        "note": "«Area» ohne Zusatz; MK nicht in der Brutto-Liste (AL, BG)"
      }
    },
    "monthly_rent": {
      "value": null,
      "status": "fehlend",
      "source": {
        "kind": "portal",
        "note": "Keine Mietangabe im Inserat"
      }
    },
    "currency": "EUR"
  },
  "object": {
    "type": "wohnung"
  },
  "notes": "GOLD (Originaltext, Abruf 13.10.2026); Grenzfälle vom Owner entschieden."
}
