{
  "id": "at-linz-franckviertel-10",
  "market": "AT",
  "captured_at": "2026-10-12T00:00:00Z",
  "source": {
    "kind": "nutzer",
    "url": "https://www.immobilienscout24.at/expose/6a226bb44833c10484f804f7",
    "documents": [
      "at-linz-franckviertel-10.txt"
    ]
  },
  "core": {
    "purchase_price": {
      "value": 139000,
      "status": "belegt",
      "source": {
        "kind": "portal",
        "quote": "Kaufpreis: 139’000 EUR"
      }
    },
    "living_area_m2": {
      "value": 49.6,
      "status": "belegt",
      "source": {
        "kind": "portal",
        "quote": "Wohnfläche: 49,6 m²"
      }
    },
    "monthly_rent": {
      "value": null,
      "status": "fehlend",
      "source": {
        "kind": "portal",
        "note": "Keine Mietangabe im Text"
      }
    },
    "currency": "EUR"
  },
  "object": {
    "type": "wohnung"
  },
  "notes": "GOLD (Regeltest auf Zusammenfassung vom 12.10.2026); Grenzfälle vom Owner entschieden."
}
