{
  "id": "hr-osijek-jug-20",
  "market": "HR",
  "captured_at": "2026-10-12T00:00:00Z",
  "source": {
    "kind": "nutzer",
    "url": "https://www.nekretnine.hr/oglasi/4044593/",
    "documents": [
      "hr-osijek-jug-20.txt"
    ]
  },
  "core": {
    "purchase_price": {
      "value": 95000,
      "status": "belegt",
      "source": {
        "kind": "portal",
        "quote": "Kaufpreis: 95’000 EUR"
      }
    },
    "living_area_m2": {
      "value": 31.48,
      "status": "belegt",
      "source": {
        "kind": "portal",
        "quote": "Fläche: 31,48 m²"
      }
    },
    "monthly_rent": {
      "value": null,
      "status": "fehlend",
      "source": {
        "kind": "portal",
        "note": "Keine Mietangabe im Text"
      }
    },
    "currency": "EUR"
  },
  "object": {
    "type": "wohnung"
  },
  "notes": "GOLD (Regeltest auf Zusammenfassung vom 12.10.2026); Grenzfälle vom Owner entschieden."
}
